{
 "format": "plugin-layout-descriptor", "version": 1, "plugin": "Solomon", "baseWidth": 980, "baseHeight": 720,
 "elements": [
  {"id": "panel.osc", "type": "panel", "label": "Oscillator", "x": 14, "y": 94, "w": 336, "h": 238},
  {"id": "panel.filter", "type": "panel", "label": "Filter", "x": 358, "y": 94, "w": 393, "h": 238},
  {"id": "panel.lfo", "type": "panel", "label": "LFO", "x": 759, "y": 94, "w": 207, "h": 238},
  {"id": "panel.ampEnv", "type": "panel", "label": "Amp envelope", "x": 14, "y": 340, "w": 472, "h": 149},
  {"id": "panel.fltEnv", "type": "panel", "label": "Filter envelope", "x": 494, "y": 340, "w": 472, "h": 149},
  {"id": "panel.matrix", "type": "panel", "label": "Modulation matrix", "x": 14, "y": 497, "w": 952, "h": 209},
  {"id": "title", "type": "label", "label": "Title", "x": 14, "y": 14, "w": 150, "h": 44},
  {"id": "theme", "type": "menu", "label": "Theme", "locked": true, "x": 14, "y": 58, "w": 88, "h": 24},
  {"id": "layout", "type": "menu", "label": "Layout", "locked": true, "x": 112, "y": 58, "w": 52, "h": 24},
  {"id": "preset", "type": "group", "label": "Presets", "x": 164, "y": 18, "w": 330, "h": 50},
  {"id": "model", "type": "menu", "label": "Oscillator model", "param": "model", "x": 506, "y": 20, "w": 230, "h": 46},
  {"id": "meter", "type": "meter", "label": "Voices and level", "x": 774, "y": 36, "w": 102, "h": 38},
  {"id": "knob.volume", "type": "knob", "label": "Volume", "param": "volume", "x": 886, "y": 14, "w": 70, "h": 74},
  {"id": "header.osc", "type": "label", "label": "Oscillator header", "parent": "panel.osc", "x": 24, "y": 94, "w": 316, "h": 26},
  {"id": "knob.harmonics", "type": "knob", "label": "Harmonics", "param": "harmonics", "parent": "panel.osc", "x": 25, "y": 176, "w": 70, "h": 100},
  {"id": "knob.timbre", "type": "knob", "label": "Timbre", "param": "timbre", "parent": "panel.osc", "x": 106, "y": 176, "w": 70, "h": 100},
  {"id": "knob.morph", "type": "knob", "label": "Morph", "param": "morph", "parent": "panel.osc", "x": 187, "y": 176, "w": 70, "h": 100},
  {"id": "knob.tune", "type": "knob", "label": "Tune", "param": "tune", "parent": "panel.osc", "x": 268, "y": 176, "w": 70, "h": 100},
  {"id": "header.filter", "type": "label", "label": "Filter header", "parent": "panel.filter", "x": 368, "y": 96, "w": 253, "h": 22},
  {"id": "menu.filterMode", "type": "menu", "label": "Filter type", "param": "filterMode", "parent": "panel.filter", "x": 621, "y": 96, "w": 120, "h": 22},
  {"id": "graph.filter", "type": "graph", "label": "Filter response", "parent": "panel.filter", "x": 368, "y": 122, "w": 373, "h": 91},
  {"id": "knob.cutoff", "type": "knob", "label": "Cutoff", "param": "cutoff", "parent": "panel.filter", "x": 425, "y": 223, "w": 70, "h": 100},
  {"id": "knob.resonance", "type": "knob", "label": "Resonance", "param": "resonance", "parent": "panel.filter", "x": 613, "y": 223, "w": 70, "h": 100},
  {"id": "header.lfo", "type": "label", "label": "LFO header", "parent": "panel.lfo", "x": 769, "y": 96, "w": 75, "h": 22},
  {"id": "menu.lfoShape", "type": "menu", "label": "LFO shape", "param": "lfoShape", "parent": "panel.lfo", "x": 844, "y": 96, "w": 112, "h": 22},
  {"id": "knob.lfoRate", "type": "knob", "label": "LFO rate", "param": "lfoRate", "parent": "panel.lfo", "x": 827, "y": 176, "w": 70, "h": 100},
  {"id": "header.ampEnv", "type": "label", "label": "Amp envelope header", "parent": "panel.ampEnv", "x": 24, "y": 340, "w": 452, "h": 26},
  {"id": "graph.ampEnv", "type": "graph", "label": "Amp envelope shape", "parent": "panel.ampEnv", "x": 321, "y": 372, "w": 153, "h": 111},
  {"id": "header.fltEnv", "type": "label", "label": "Filter envelope header", "parent": "panel.fltEnv", "x": 504, "y": 340, "w": 452, "h": 26},
  {"id": "graph.fltEnv", "type": "graph", "label": "Filter envelope shape", "parent": "panel.fltEnv", "x": 801, "y": 372, "w": 153, "h": 111},
  {"id": "knob.ampA", "type": "knob", "label": "Amp A", "param": "ampA", "parent": "panel.ampEnv", "x": 21, "y": 377, "w": 70, "h": 100},
  {"id": "knob.fltA", "type": "knob", "label": "Filter A", "param": "fltA", "parent": "panel.fltEnv", "x": 501, "y": 377, "w": 70, "h": 100},
  {"id": "knob.ampD", "type": "knob", "label": "Amp D", "param": "ampD", "parent": "panel.ampEnv", "x": 94, "y": 377, "w": 70, "h": 100},
  {"id": "knob.fltD", "type": "knob", "label": "Filter D", "param": "fltD", "parent": "panel.fltEnv", "x": 574, "y": 377, "w": 70, "h": 100},
  {"id": "knob.ampS", "type": "knob", "label": "Amp S", "param": "ampS", "parent": "panel.ampEnv", "x": 167, "y": 377, "w": 70, "h": 100},
  {"id": "knob.fltS", "type": "knob", "label": "Filter S", "param": "fltS", "parent": "panel.fltEnv", "x": 647, "y": 377, "w": 70, "h": 100},
  {"id": "knob.ampR", "type": "knob", "label": "Amp R", "param": "ampR", "parent": "panel.ampEnv", "x": 240, "y": 377, "w": 70, "h": 100},
  {"id": "knob.fltR", "type": "knob", "label": "Filter R", "param": "fltR", "parent": "panel.fltEnv", "x": 720, "y": 377, "w": 70, "h": 100},
  {"id": "header.matrix", "type": "label", "label": "Matrix header", "parent": "panel.matrix", "x": 24, "y": 497, "w": 932, "h": 26},
  {"id": "matrix.src.0", "type": "label", "label": "LFO", "parent": "panel.matrix", "x": 24, "y": 546, "w": 110, "h": 19},
  {"id": "matrix.bar.0", "type": "meter", "label": "LFO level", "parent": "panel.matrix", "x": 26, "y": 565, "w": 100, "h": 15},
  {"id": "matrix.src.1", "type": "label", "label": "Envelope", "parent": "panel.matrix", "x": 24, "y": 586, "w": 110, "h": 19},
  {"id": "matrix.bar.1", "type": "meter", "label": "Envelope level", "parent": "panel.matrix", "x": 26, "y": 605, "w": 100, "h": 15},
  {"id": "matrix.src.2", "type": "label", "label": "Velocity", "parent": "panel.matrix", "x": 24, "y": 626, "w": 110, "h": 19},
  {"id": "matrix.bar.2", "type": "meter", "label": "Velocity level", "parent": "panel.matrix", "x": 26, "y": 645, "w": 100, "h": 15},
  {"id": "matrix.src.3", "type": "label", "label": "Pressure", "parent": "panel.matrix", "x": 24, "y": 666, "w": 110, "h": 19},
  {"id": "matrix.bar.3", "type": "meter", "label": "Pressure level", "parent": "panel.matrix", "x": 26, "y": 685, "w": 100, "h": 15},
  {"id": "matrix.dst.0", "type": "label", "label": "Timbre", "parent": "panel.matrix", "x": 134, "y": 525, "w": 205, "h": 18},
  {"id": "matrix.dst.1", "type": "label", "label": "Morph", "parent": "panel.matrix", "x": 339, "y": 525, "w": 205, "h": 18},
  {"id": "matrix.dst.2", "type": "label", "label": "Harmonics", "parent": "panel.matrix", "x": 544, "y": 525, "w": 205, "h": 18},
  {"id": "matrix.dst.3", "type": "label", "label": "Cutoff", "parent": "panel.matrix", "x": 749, "y": 525, "w": 205, "h": 18},
  {"id": "matrix.cell.0.0", "type": "slider", "label": "LFO to Timbre", "param": "mod_lfo_timbre", "parent": "panel.matrix", "x": 142, "y": 545, "w": 189, "h": 36},
  {"id": "matrix.cell.0.1", "type": "slider", "label": "LFO to Morph", "param": "mod_lfo_morph", "parent": "panel.matrix", "x": 347, "y": 545, "w": 189, "h": 36},
  {"id": "matrix.cell.0.2", "type": "slider", "label": "LFO to Harmonics", "param": "mod_lfo_harm", "parent": "panel.matrix", "x": 552, "y": 545, "w": 189, "h": 36},
  {"id": "matrix.cell.0.3", "type": "slider", "label": "LFO to Cutoff", "param": "mod_lfo_cutoff", "parent": "panel.matrix", "x": 757, "y": 545, "w": 189, "h": 36},
  {"id": "matrix.cell.1.0", "type": "slider", "label": "Envelope to Timbre", "param": "mod_env_timbre", "parent": "panel.matrix", "x": 142, "y": 585, "w": 189, "h": 36},
  {"id": "matrix.cell.1.1", "type": "slider", "label": "Envelope to Morph", "param": "mod_env_morph", "parent": "panel.matrix", "x": 347, "y": 585, "w": 189, "h": 36},
  {"id": "matrix.cell.1.2", "type": "slider", "label": "Envelope to Harmonics", "param": "mod_env_harm", "parent": "panel.matrix", "x": 552, "y": 585, "w": 189, "h": 36},
  {"id": "matrix.cell.1.3", "type": "slider", "label": "Envelope to Cutoff", "param": "mod_env_cutoff", "parent": "panel.matrix", "x": 757, "y": 585, "w": 189, "h": 36},
  {"id": "matrix.cell.2.0", "type": "slider", "label": "Velocity to Timbre", "param": "mod_vel_timbre", "parent": "panel.matrix", "x": 142, "y": 625, "w": 189, "h": 36},
  {"id": "matrix.cell.2.1", "type": "slider", "label": "Velocity to Morph", "param": "mod_vel_morph", "parent": "panel.matrix", "x": 347, "y": 625, "w": 189, "h": 36},
  {"id": "matrix.cell.2.2", "type": "slider", "label": "Velocity to Harmonics", "param": "mod_vel_harm", "parent": "panel.matrix", "x": 552, "y": 625, "w": 189, "h": 36},
  {"id": "matrix.cell.2.3", "type": "slider", "label": "Velocity to Cutoff", "param": "mod_vel_cutoff", "parent": "panel.matrix", "x": 757, "y": 625, "w": 189, "h": 36},
  {"id": "matrix.cell.3.0", "type": "slider", "label": "Pressure to Timbre", "param": "mod_pres_timbre", "parent": "panel.matrix", "x": 142, "y": 665, "w": 189, "h": 36},
  {"id": "matrix.cell.3.1", "type": "slider", "label": "Pressure to Morph", "param": "mod_pres_morph", "parent": "panel.matrix", "x": 347, "y": 665, "w": 189, "h": 36},
  {"id": "matrix.cell.3.2", "type": "slider", "label": "Pressure to Harmonics", "param": "mod_pres_harm", "parent": "panel.matrix", "x": 552, "y": 665, "w": 189, "h": 36},
  {"id": "matrix.cell.3.3", "type": "slider", "label": "Pressure to Cutoff", "param": "mod_pres_cutoff", "parent": "panel.matrix", "x": 757, "y": 665, "w": 189, "h": 36}
 ]
}
